question;answer;category;source;source_url
¿Cómo se relaciona Cuidados Frente al COVID-19 - De Seguridad y Prevención laboral con los servicios de Deseguridad.net?;"Los ""Cuidados Frente al COVID-19 - De Seguridad y Prevención laboral"" se relacionan directamente con los servicios de Deseguridad.net a través de nuestra misión de promover la salud, prevenir riesgos y generar conocimiento en las empresas. En este contexto, Deseguridad.net se compromete a garantizar la continuidad de los servicios, acogiéndose a los lineamientos de la Organización Mundial de la Salud y las autoridades colombianas. Proporcionamos recomendaciones sobre higiene y protocolos esenciales para manejar la situación del COVID-19, así como información relevante para apoyar a las empresas y sus colaboradores en la promoción de la salud y la prevención de enfermedades. Para más información sobre nuestros servicios y cómo podemos apoyarte en esta temática, puedes visitar nuestra página web y explorar las soluciones que ofrecemos.";cuidados-frente-al-covid-19;Web (HTML);https://deseguridad.net/cuidados-frente-al-covid-19/
¿De qué trata ¿Estás Preparado para la Transformación del Bienestar Laboral? - De Seguridad y Prevención laboral y qué información principal ofrece?;"El contenido titulado ""¿Estás Preparado para la Transformación del Bienestar Laboral? - De Seguridad y Prevención laboral"" trata sobre la reciente Resolución 1843 del Ministerio del Trabajo en Colombia, la cual convierte las pausas activas en una obligación legal para las empresas a partir de 2025. Este cambio normativo es visto como una oportunidad para mejorar el bienestar, la motivación y la productividad en el entorno laboral. La información principal que se ofrece incluye la importancia de las pausas activas como método de prevención de riesgos como fatiga, estrés y lesiones, así como su impacto positivo en la salud física y mental, el ambiente laboral y la reputación de la empresa. Además, se sugieren pasos para implementar pausas activas efectivas, como realizar un diagnóstico adecuado, ofrecer diversidad de ejercicios y mantener un liderazgo visible que fomente estos hábitos.";estas-preparado-para-la-transformacion-del-bienestar-laboral;Web (HTML);https://deseguridad.net/estas-preparado-para-la-transformacion-del-bienestar-laboral/
¿Cómo se relaciona ¿Estás Preparado para la Transformación del Bienestar Laboral? - De Seguridad y Prevención laboral con los servicios de Deseguridad.net?;La transformación del bienestar laboral se relaciona directamente con los servicios de Deseguridad.net a través de la implementación de estrategias como las pausas activas, que, según la reciente Resolución 1843 del Ministerio del Trabajo en Colombia, se han convertido en una obligación legal. En Deseguridad.net, entendemos la importancia de estas pausas no solo como un cumplimiento normativo, sino como una oportunidad para mejorar la salud física y mental de los empleados, prevenir riesgos, y crear un entorno laboral más humano y productivo. Ofrecemos servicios de diagnóstico, mediciones y diseño de programas que ayudan a las empresas a integrar pausas activas efectivas en su cultura organizacional, potenciando así el bienestar laboral y el rendimiento del equipo. Para más información sobre cómo podemos ayudar a tu empresa, visita nuestra página para cotizar: https://deseguridad.net/riesgo-psicosocial/.;estas-preparado-para-la-transformacion-del-bienestar-laboral;Web (HTML);https://deseguridad.net/estas-preparado-para-la-transformacion-del-bienestar-laboral/
¿De qué trata SG-SST: Inversión Esencial para el Éxito y Bienestar de tu Empresa - De Seguridad y Prevención laboral y qué información principal ofrece?;"El artículo ""SG-SST: Inversión Esencial para el Éxito y Bienestar de tu Empresa - De Seguridad y Prevención laboral"" destaca la importancia de la seguridad y salud en el trabajo como un componente fundamental para el éxito de cualquier empresa. Se argumenta que la seguridad laboral no debe considerarse un gasto, sino una inversión estratégica que disminuye imprevistos, reduce costos médicos y legales, y motiva al equipo al crear un ambiente de trabajo más seguro y confiable. Además, se enfatiza la necesidad de construir una cultura de seguridad en la organización, donde todos los empleados participen en la identificación de riesgos y en la propuesta de mejoras, fomentando así un sentido de pertenencia y cuidando el bienestar colectivo. También se menciona la importancia de tomar acciones preventivas y utilizar herramientas como diagnósticos, evaluaciones psicosociales y estudios ergonómicos para anticiparse a posibles accidentes. En resumen, el contenido del artículo presenta la seguridad laboral como una inversión que potencia la productividad y sostenibilidad del negocio, destacando soluciones concretas que Deseguridad.net puede ofrecer para transformar la cultura organizacional en Colombia.";sg-sst-inversion-esencial-para-el-exito-y-bienestar-de-tu-empresa;Web (HTML);https://deseguridad.net/sg-sst-inversion-esencial-para-el-exito-y-bienestar-de-tu-empresa/
¿Cómo se relaciona SG-SST: Inversión Esencial para el Éxito y Bienestar de tu Empresa - De Seguridad y Prevención laboral con los servicios de Deseguridad.net?;"El contenido titulado ""SG-SST: Inversión Esencial para el Éxito y Bienestar de tu Empresa - De Seguridad y Prevención laboral"" destaca la importancia de la seguridad y salud en el trabajo como un pilar fundamental para el éxito de cualquier empresa, alineándose perfectamente con los servicios de Deseguridad.net. Nuestra consultoría se enfoca en ofrecer soluciones serias que transforman a las empresas en toda Colombia, enfatizando que la seguridad laboral no es solo una obligación, sino una inversión que conduce a la reducción de imprevistos, ahorros en costos y un mayor compromiso del equipo. Además, promovemos la cultura de seguridad, donde todos los empleados pueden participar activamente en la identificación de riesgos y en la mejora continua de su entorno laboral. A través de diagnósticos, evaluaciones psicosociales, estudios ergonómicos y mediciones higiénicas, proporcionamos herramientas prácticas para prevenir accidentes y fomentar un entorno de trabajo saludable y productivo. Para más detalles sobre nuestros servicios, puedes visitar nuestra página en https://deseguridad.net/.";sg-sst-inversion-esencial-para-el-exito-y-bienestar-de-tu-empresa;Web (HTML);https://deseguridad.net/sg-sst-inversion-esencial-para-el-exito-y-bienestar-de-tu-empresa/
¿De qué trata Evalúa Riesgos Psicosociales: Clave para el Bienestar Laboral - De Seguridad y Prevención laboral y qué información principal ofrece?;"El artículo ""Evalúa Riesgos Psicosociales: Clave para el Bienestar Laboral - De Seguridad y Prevención laboral"" aborda la importancia de la evaluación de riesgos psicosociales en el entorno laboral, destacando que el bienestar emocional y psicológico de los empleados es tan esencial como su seguridad física. Se menciona que, con la nueva ley 2460 de 2025, las empresas asumen un rol crucial en la responsabilidad de la salud mental, lo que implica mayores exigencias en las visitas de inspección que van más allá de la aplicación del BRP. La evaluación de estos riesgos permite a las organizaciones identificar factores como la carga de trabajo y las relaciones interpersonales que pueden generar estrés o ansiedad, actuando como un mecanismo preventivo que ayuda a evitar crisis. Además, se resalta que la digitalización y el uso de aplicaciones específicas para esta gestión facilitan la recolección y análisis de datos, así como la implementación de políticas que mejoren el bienestar de los empleados. Deseguridad.net se posiciona como un referente en este ámbito, ofreciendo servicios como baterías de riesgo psicosocial, mediciones higiénicas, análisis de puestos de trabajo y consultoría integral en SG-SST.";evalua-riesgos-psicosociales-clave-para-el-bienestar-laboral;Web (HTML);https://deseguridad.net/evalua-riesgos-psicosociales-clave-para-el-bienestar-laboral/
¿Cómo se relaciona Evalúa Riesgos Psicosociales: Clave para el Bienestar Laboral - De Seguridad y Prevención laboral con los servicios de Deseguridad.net?;La evaluación de riesgos psicosociales es fundamental para el bienestar laboral, ya que analiza los aspectos del entorno laboral que pueden afectar la salud mental de los empleados, como la carga de trabajo y las relaciones interpersonales. Deseguridad.net se posiciona como un referente en este ámbito en Latinoamérica, ofreciendo no solo baterías de riesgo psicosocial, sino también intervenciones, mediciones higiénicas, análisis de puestos de trabajo y consultoría integral en SG-SST. Con más de nueve años de experiencia, la empresa utiliza aplicaciones diseñadas para gestionar estos riesgos de manera eficiente, permitiendo un monitoreo constante y la implementación de políticas que mejoran la satisfacción laboral. Para más detalles sobre nuestros servicios, puedes cotizar en la siguiente ruta: https://deseguridad.net/riesgo-psicosocial/.;evalua-riesgos-psicosociales-clave-para-el-bienestar-laboral;Web (HTML);https://deseguridad.net/evalua-riesgos-psicosociales-clave-para-el-bienestar-laboral/
¿De qué trata Boletín 04 - De Seguridad y Prevención laboral y qué información principal ofrece?;El Boletín 04 - De Seguridad y Prevención Laboral trata sobre la actualización normativa en Colombia, donde se presentan las principales regulaciones que fueron expedidas e incluidas en la legislación durante el mes de abril de 2022. También se enfoca en la mejora de las condiciones de salud de los trabajadores y aborda temas de actualidad como el bullying infantil y la importancia del descanso adecuado, incluyendo recomendaciones para mejorar la calidad del sueño. Además, se incluyen novedades sobre tendencias, el uso de tecnología en los procesos industriales, y información sobre cursos y seminarios que pueden ayudar a las empresas a innovar y generar conocimiento. Para más detalles, puedes descargar el boletín completo desde la ruta indicada en la página oficial.;boletin-04;Web (HTML);https://deseguridad.net/boletin-04/
¿Cómo se relaciona Boletín 04 - De Seguridad y Prevención laboral con los servicios de Deseguridad.net?;El Boletín 04 - De Seguridad y Prevención laboral de Deseguridad.net destaca la importancia de la actualización normativa en Colombia, lo que se relaciona directamente con nuestros servicios de consultoría en seguridad y salud en el trabajo (SG-SST). Asimismo, el boletín aborda temas relevantes como el bienestar de los trabajadores y la mejora de sus condiciones de salud, que son fundamentales en nuestras evaluaciones de riesgos y calibraciones. Además, incluye información sobre cursos y seminarios que pueden complementar los procesos de formación y conocimiento en las empresas, alineándose con nuestro objetivo de ofrecer soluciones integrales en materia de seguridad laboral. Para más detalles y acceder al boletín completo, puedes visitar nuestra página.;boletin-04;Web (HTML);https://deseguridad.net/boletin-04/
¿De qué trata Innovacion en la seguridad y la salud en el trabajo - De Seguridad y Prevención laboral y qué información principal ofrece?;"El contenido titulado ""Innovación en la seguridad y la salud en el trabajo - De Seguridad y Prevención laboral"" aborda la importancia de la innovación como un elemento clave para la transformación y el crecimiento dentro de las empresas. Define la innovación de acuerdo con la OCDE, resaltando que se refiere a la implementación de productos, procesos, métodos de mercado u organizativos que son nuevos o significativamente mejorados. Además, menciona que el propósito principal de la innovación es fomentar el crecimiento sostenible y la competitividad a través de la identificación de oportunidades dentro y fuera de la organización, así como la necesidad de involucrar a los grupos de interés. Destaca que la innovación debe ser un proceso continuo que genere cambios sustanciales, en el cual el compromiso gerencial y la flexibilidad organizacional son fundamentales. También se menciona el impacto de la pandemia en cómo las empresas han adaptado sus modelos de trabajo, incluyendo el teletrabajo y ajustes en horarios y funciones, como parte de su estrategia de innovación constante. En resumen, el enfoque se centra en cómo la innovación puede mejorar la seguridad y la salud en el trabajo, adaptándose a un entorno laboral en constante cambio.";innovacion-en-la-seguridad-y-la-salud-en-el-trabajo;Web (HTML);https://deseguridad.net/innovacion-en-la-seguridad-y-la-salud-en-el-trabajo/
¿Cómo se relaciona Innovacion en la seguridad y la salud en el trabajo - De Seguridad y Prevención laboral con los servicios de Deseguridad.net?;La innovación en la seguridad y la salud en el trabajo se relaciona directamente con los servicios de Deseguridad.net mediante la implementación de nuevos procesos y prácticas que buscan mejorar continuamente la seguridad laboral y la prevención de riesgos. En el contexto actual, donde la competitividad y el crecimiento sostenible son fundamentales, Deseguridad.net se enfoca en integrar enfoques innovadores para identificar oportunidades y necesidades en el entorno laboral. Al fomentar la creatividad y adaptar los modelos de trabajo, como el teletrabajo y la flexibilidad organizativa, nuestros servicios se adaptan a las exigencias actuales del mercado, contribuyendo a un entorno laboral más seguro y eficiente. Para más información acerca de nuestros servicios y cómo pueden ayudar en estos aspectos, te invitamos a visitar nuestra página web.;innovacion-en-la-seguridad-y-la-salud-en-el-trabajo;Web (HTML);https://deseguridad.net/innovacion-en-la-seguridad-y-la-salud-en-el-trabajo/
¿De qué trata RETOS PARA LAS EMPRESAS EN SST FRENTE A LAS ACCIONES DE INSPECCIÓN, VIGILANCIA Y CONTROL DEL GOBIERNO - De Seguridad y Prevención laboral y qué información principal ofrece?;"El contenido titulado ""RETOS PARA LAS EMPRESAS EN SST FRENTE A LAS ACCIONES DE INSPECCIÓN, VIGILANCIA Y CONTROL DEL GOBIERNO"" aborda la labor del Estado colombiano en la inspección, vigilancia y control en relación con la seguridad y salud en el trabajo (SST), destacando la importancia del cumplimiento de requisitos legales para evitar sanciones y multas, que pueden llegar incluso al cierre temporal de empresas. Se menciona el papel del Ministerio de Trabajo en la ampliación de su función de inspección, que incluye la revisión de diversos aspectos como el perfil sociodemográfico, tipos de contrato, cumplimiento de normas, y el Sistema de Gestión de Seguridad y Salud en el Trabajo (SGSST). Además, se hace referencia a la Unidad de Gestión Pensional y Contribuciones Parafiscales (UGPP), que supervisa el cumplimiento de obligaciones parafiscales y ofrece herramientas tecnológicas como el Estado Único de Cuenta para que las empresas y ciudadanos conozcan su estado en el sistema de protección social. Finalmente, se invita a las empresas a realizar evaluaciones sobre el cumplimiento de requisitos legales en SST para prepararse y tomar acciones preventivas.";retos-para-las-empresas-en-sst-frente-a-las-acciones-de-inspeccion-vigilancia-y-control-del-gobierno;Web (HTML);https://deseguridad.net/retos-para-las-empresas-en-sst-frente-a-las-acciones-de-inspeccion-vigilancia-y-control-del-gobierno/
¿Cómo se relaciona RETOS PARA LAS EMPRESAS EN SST FRENTE A LAS ACCIONES DE INSPECCIÓN, VIGILANCIA Y CONTROL DEL GOBIERNO - De Seguridad y Prevención laboral con los servicios de Deseguridad.net?;Los retos para las empresas en Seguridad y Salud en el Trabajo (SST) frente a las acciones de inspección, vigilancia y control del gobierno están directamente relacionados con los servicios que ofrece Deseguridad.net, los cuales se centran en ayudar a las empresas a cumplir con los requisitos legales en esta área. Nuestros servicios incluyen la evaluación del cumplimiento de los requisitos legales exigidos en materia de seguridad social y riesgos laborales, lo cual es fundamental para evitar sanciones y multas que pueden ser onerosas e incluso llevar al cierre temporal de negocios. Además, desde Deseguridad.net, promovemos la creación de empresas resilientes y comprometidas con la salud laboral y los derechos de sus trabajadores, ofreciendo consultoría y herramientas necesarias para la gestión del Sistema de Gestión de Seguridad y Salud en el Trabajo (SG-SST). Para una evaluación más detallada de cómo podemos apoyar a su empresa en estos desafíos, puede cotizar nuestros servicios en la siguiente ruta: https://deseguridad.net.;retos-para-las-empresas-en-sst-frente-a-las-acciones-de-inspeccion-vigilancia-y-control-del-gobierno;Web (HTML);https://deseguridad.net/retos-para-las-empresas-en-sst-frente-a-las-acciones-de-inspeccion-vigilancia-y-control-del-gobierno/
¿De qué trata Tu Empresa Podría Tener una Fuga de Dinero - De Seguridad y Prevención laboral y qué información principal ofrece?;"""Tu Empresa Podría Tener una Fuga de Dinero - De Seguridad y Prevención laboral"" trata sobre la identificación y manejo de riesgos económicos y operativos en las empresas, especialmente relacionados con la seguridad y la prevención laboral. La información principal que se ofrece incluye un checklist útil para detectar si la empresa está aprovechando todos los beneficios fiscales disponibles, identificar problemas que puedan estar afectando la rentabilidad, y la necesidad de contar con una estrategia contable más allá de solo números. Se sugieren pasos prácticos para utilizar el checklist, como dedicar tiempo a revisar informes contables, responder honestamente a las preguntas planteadas, y priorizar los puntos críticos para discutirlos con el equipo o un asesor experto. Esto se presenta como una herramienta para que los empresarios tomen el control de su rentabilidad y mejoren su situación financiera.";diagnostico-financiero;Web (HTML);https://deseguridad.net/diagnostico-financiero/
¿Cómo se relaciona Tu Empresa Podría Tener una Fuga de Dinero - De Seguridad y Prevención laboral con los servicios de Deseguridad.net?;"El contenido ""Tu Empresa Podría Tener una Fuga de Dinero - De Seguridad y Prevención laboral"" se relaciona directamente con los servicios de Deseguridad.net al ofrecer un enfoque proactivo para identificar y gestionar riesgos que pueden afectar la rentabilidad de una empresa. A través de herramientas y recursos como checklist y diagnósticos rápidos, ayudamos a las empresas a evaluar su situación fiscal y operativa, permitiendo detectar áreas de mejora y reducir fugas de dinero. Nuestros servicios en consultoría, mediciones y análisis de riesgos están diseñados para ayudar a las empresas a optimizar sus costos y mejorar su estructura fiscal, contribuyendo así a una mejor rentabilidad y prevención de pérdidas. Para más información sobre cómo podemos asistir a tu empresa, te invito a visitar nuestra página principal en https://deseguridad.net.";diagnostico-financiero;Web (HTML);https://deseguridad.net/diagnostico-financiero/
¿De qué trata La Guía Definitiva para Blindar tu Empresa Contra Sanciones de la UGPP - De Seguridad y Prevención laboral y qué información principal ofrece?;La Guía Definitiva para Blindar tu Empresa Contra Sanciones de la UGPP - De Seguridad y Prevención Laboral es una herramienta clave diseñada para ayudar a gerentes generales, directores de recursos humanos, contadores y cualquier persona responsable de la liquidación de la nómina en pequeñas y medianas empresas (PYME) a evitar sanciones de la Unidad de Gestión Pensional y Parafiscales (UGPP). Esta guía ofrece un plan de acción para identificar y corregir errores potenciales en la gestión de la nómina, especialmente antes de auditorías, al contratar nuevo personal y durante la planificación anual. Incluye un diagnóstico rápido a través de un checklist de los 5 errores más comunes, así como recomendaciones específicas para revisar los pagos no salariales, como bonificaciones y auxilios. Al final, la guía propone la creación de un plan de acción con acciones inmediatas para mitigar riesgos identificados, todo con el objetivo de blinda el futuro financiero del negocio. Para obtener más información y descargar la guía, puedes dejar tus datos en la página y recibirla por correo electrónico.;la-guia-definitiva-para-blindar-tu-empresa-contra-sanciones-de-la-ugpp;Web (HTML);https://deseguridad.net/la-guia-definitiva-para-blindar-tu-empresa-contra-sanciones-de-la-ugpp/
¿Cómo se relaciona La Guía Definitiva para Blindar tu Empresa Contra Sanciones de la UGPP - De Seguridad y Prevención laboral con los servicios de Deseguridad.net?;La Guía Definitiva para Blindar tu Empresa Contra Sanciones de la UGPP - De Seguridad y Prevención laboral está totalmente alineada con los servicios de Deseguridad.net, ya que ofrece a los empresarios una herramienta indispensable para gestionar correctamente su nómina y cumplir con las normativas requeridas por la UGPP. Esta guía actúa como un recurso preventivo, proporcionando un checklist para identificar y corregir fallos antes de auditorías, optimizando la estructura de compensación y asegurando que la contratación de personal se realice de acuerdo con la normativa desde el inicio. De este modo, los servicios de Deseguridad.net complementan la información de la guía, ayudando a las empresas a operar con confianza y reducir el riesgo de sanciones millonarias, garantizando así una estructura organizacional sólida y conforme a la legislación vigente. Para obtener más información sobre nuestros servicios y cómo podemos ayudar a tu empresa, puedes visitar la ruta de contacto en nuestra web.;la-guia-definitiva-para-blindar-tu-empresa-contra-sanciones-de-la-ugpp;Web (HTML);https://deseguridad.net/la-guia-definitiva-para-blindar-tu-empresa-contra-sanciones-de-la-ugpp/
