question;answer;category;source;source_url
¿Qué ofrece exactamente Empresas mas Tranquilas, innovadoras y sostenibles - De Seguridad y Prevención laboral a las empresas en Colombia?;"""Empresas más Tranquilas, Innovadoras y Sostenibles - De Seguridad y Prevención Laboral"" ofrece a las empresas en Colombia servicios especializados en la gestión de Seguridad y Salud en el Trabajo (SG-SST). Nuestro enfoque se centra en la promoción de la salud y la prevención de riesgos laborales, ayudando a las empresas a proteger sus inversiones mediante prácticas ágiles y eficientes, como SCRUM, Kanban y Design Thinking. Ofrecemos un respaldo legal y técnico a través de un equipo multidisciplinario que incluye psicólogos, médicos e ingenieros, garantizando el cumplimiento normativo. Los servicios incluyen consultoría, capacitaciones, mediciones higiénicas ocupacionales y la Batería de Riesgo Psicosocial, con atención rápida, clara y humana, y cobertura nacional en modalidad virtual o presencial. Si deseas más información o solicitar una asesoría inicial gratuita, puedes hacerlo a través de nuestro sitio web.";inicio;Web (HTML);https://deseguridad.net/
¿Qué tipo de servicios de seguridad y salud en el trabajo ofrece Empresas mas Tranquilas, innovadoras y sostenibles - De Seguridad y Prevención laboral?;Ofrecemos una variedad de servicios especializados en Seguridad y Salud en el Trabajo (SG-SST), los cuales incluyen: consultoría en SG-SST, capacitaciones en SG-SST, mediciones higiénicas ocupacionales, evaluación de riesgos psicosociales a través de la Batería de Riesgo Psicosocial en Colombia, y la creación de profesiogramas documentales técnicos. Nos destacamos por nuestra atención rápida, clara y humana, así como por nuestra cobertura nacional con modalidades virtuales o presenciales. Además, contamos con un equipo multidisciplinario de profesionales y un respaldo legal y técnico que garantiza el cumplimiento normativo. Si deseas más detalles sobre nuestros servicios, puedes visitar nuestra página y solicitar una asesoría inicial gratuita.;inicio;Web (HTML);https://deseguridad.net/
¿Por qué una empresa debería trabajar con Empresas mas Tranquilas, innovadoras y sostenibles - De Seguridad y Prevención laboral?;Una empresa debería trabajar con Deseguridad.net porque ofrecemos un enfoque integral en la promoción de la salud y la prevención de riesgos laborales, ayudando a las organizaciones a cumplir con el SG-SST de manera eficiente y con menor complejidad. Constatamos que el 70% de las empresas en Colombia incumplen este sistema, por lo que nuestra experiencia y respaldo legal y técnico son fundamentales para evitar sanciones y gestionar adecuadamente los riesgos. Contamos con un equipo multidisciplinario y utilizamos tecnologías innovadoras para simplificar la gestión, lo que se traduce en una atención rápida, clara y humana. Al elegirnos como socios estratégicos, las empresas no solo protegen su inversión, sino que también mejoran su productividad y bienestar laboral. Para más información sobre nuestros servicios, puedes solicitar una asesoría inicial gratuita y sin compromiso en nuestra página.;inicio;Web (HTML);https://deseguridad.net/
¿Cómo puedo empezar a trabajar con Empresas mas Tranquilas, innovadoras y sostenibles - De Seguridad y Prevención laboral?;"Para comenzar a trabajar con ""Empresas más Tranquilas, innovadoras y sostenibles - De Seguridad y Prevención laboral"", puedes solicitar una asesoría inicial gratuita y sin compromiso. Simplemente déjanos tus datos en nuestra página web, y pronto nos pondremos en contacto para iniciar un diagnóstico que se ajuste a las necesidades de tu empresa. Además, si tienes interés en servicios específicos como el Profesiograma o la Batería de Riesgo Psicosocial, puedes obtener más detalles y cotizaciones directas en la siguiente ruta: https://deseguridad.net/riesgo-psicosocial/.";inicio;Web (HTML);https://deseguridad.net/
¿Qué es Politica de Tratamiento de Datos - De Seguridad y Prevención laboral y para qué sirve?;"La ""Política de Tratamiento de Datos - De Seguridad y Prevención laboral"" es un documento que establece las pautas y el enfoque que Deseguridad.net adopta para garantizar el manejo adecuado de la información personal de acuerdo con la normativa vigente. Su propósito es asegurar a los usuarios que sus datos serán tratados de manera responsable y conforme a la legislación correspondiente, protegiendo así su privacidad y derechos. Para más información detallada sobre esta política, puedes consultar directamente nuestro sitio web en https://deseguridad.net/politica-tratamiento-datos/.";politica-de-tratamiento-de-datos;Web (HTML);https://deseguridad.net/politica-de-tratamiento-de-datos/
¿Qué información cubre exactamente Politica de Tratamiento de Datos - De Seguridad y Prevención laboral?;"La ""Política de Tratamiento de Datos - De Seguridad y Prevención Laboral"" cubre la manera en que se manejan y protegen los datos personales de los clientes, asegurando que el tratamiento de dicha información se realice conforme a la normativa vigente. Para obtener información más específica sobre los aspectos cubiertos en esta política, te invitamos a visitar nuestra página y explorar los detalles correspondientes.";politica-de-tratamiento-de-datos;Web (HTML);https://deseguridad.net/politica-de-tratamiento-de-datos/
¿Qué datos personales se tratan según Politica de Tratamiento de Datos - De Seguridad y Prevención laboral?;La Política de Tratamiento de Datos - De Seguridad y Prevención Laboral detalla que los datos personales tratados se manejan de acuerdo con la normatividad vigente, sin especificar en el contenido los tipos concretos de datos personales que se manejan. Para obtener información más precisa sobre los datos personales específicos tratados, te recomendamos visitar nuestra política completa en la página web o contactar directamente a través del siguiente enlace: https://deseguridad.net/politica-de-tratamiento-de-datos/;politica-de-tratamiento-de-datos;Web (HTML);https://deseguridad.net/politica-de-tratamiento-de-datos/
¿Cómo puede un usuario ejercer sus derechos de protección de datos según Politica de Tratamiento de Datos - De Seguridad y Prevención laboral?;"Un usuario puede ejercer sus derechos de protección de datos según la ""Política de Tratamiento de Datos - De Seguridad y Prevención laboral"" contactando directamente a nuestro equipo a través de los canales dispuestos para tal fin, donde se les brindará la orientación necesaria para el ejercicio de sus derechos. Para obtener más información y detalles específicos sobre el proceso, puedes visitar la siguiente ruta: https://deseguridad.net/politica-de-tratamiento-de-datos/.";politica-de-tratamiento-de-datos;Web (HTML);https://deseguridad.net/politica-de-tratamiento-de-datos/
¿Qué es Terminos y condiciones - De Seguridad y Prevención laboral y para qué sirve?;"Los ""Términos y condiciones - De Seguridad y Prevención laboral"" son un conjunto de disposiciones legales que rigen el uso de los servicios de Deseguridad.net, estableciendo las normas bajo las cuales se recogen, manejan y protegen los datos personales de los usuarios. Estos términos solicitan la autorización de los titulares de los datos para su inclusión en bases de datos de TECNOINNSOFT SAS, con el objetivo de utilizar la información para marketing, seguimiento de ofertas y gestión comercial, además de garantizar que los usuarios pueden ejercer sus derechos sobre sus datos. Es un documento que asegura el cumplimiento de la ley estatutaria 1581 de 2012 y sus normativas relacionadas, protegiendo tanto a la empresa como a los usuarios en el tratamiento de información personal.";terminos-y-condiciones;Web (HTML);https://deseguridad.net/terminos-y-condiciones/
¿Qué información cubre exactamente Terminos y condiciones - De Seguridad y Prevención laboral?;"Los ""Términos y condiciones - De Seguridad y Prevención laboral"" cubren aspectos relacionados con la autorización del tratamiento de datos personales conforme a la ley estatutaria 1581 de 2012 de protección de datos. Incluyen información sobre la incorporación de datos en una base de datos de TECNOINNSOFT SAS, la finalidad de uso de estos datos para procesos de marketing y prospección comercial, la posible transferencia a terceras entidades relacionadas con marketing de afiliados, así como la gestión comercial. También se detalla qué derechos tiene el titular de los datos, como acceso, corrección, supresión, renoviación o reclamo por infracción, así como la información que se recopila: nombre, teléfono, correo electrónico, nombre de la empresa, ciudad y productos o servicios de interés. Finalmente, se establece que al registrarse en las páginas mencionadas se acepta el tratamiento de los datos y se ofrece la posibilidad de cancelar o modificar la suscripción enviando un correo electrónico.";terminos-y-condiciones;Web (HTML);https://deseguridad.net/terminos-y-condiciones/
¿Qué derechos y deberes tiene el usuario según Terminos y condiciones - De Seguridad y Prevención laboral?;"Según los ""Términos y condiciones - De Seguridad y Prevención laboral"", el usuario tiene el derecho a acceder, corregir, suprimir, renovar o reclamar por infracción sobre sus datos personales. Para ejercer estos derechos, debe enviar un escrito a la dirección de correo electrónico [email protected], indicando en el asunto el derecho que desea ejercer. Asimismo, el usuario es responsable de proporcionar datos verídicos y de mantener actualizada la información que aporte en el registro. Además, se entiende que al registrarse en las páginas de Tecnoinnsoftware.com, deseguridad.net o clubdelcambio.co, el usuario autoriza el tratamiento de sus datos en los términos descritos en la normativa de protección de datos.";terminos-y-condiciones;Web (HTML);https://deseguridad.net/terminos-y-condiciones/
¿Qué datos personales se tratan según Terminos y condiciones - De Seguridad y Prevención laboral?;"Según los ""Términos y condiciones - De Seguridad y Prevención Laboral"", se tratan los siguientes datos personales: Nombre, Teléfono, dirección de correo electrónico, y alternativamente, Nombre de la empresa y ciudad, así como el producto o servicio en el que está interesado.";terminos-y-condiciones;Web (HTML);https://deseguridad.net/terminos-y-condiciones/
¿Cómo puede un usuario ejercer sus derechos de protección de datos según Terminos y condiciones - De Seguridad y Prevención laboral?;Un usuario puede ejercer sus derechos de acceso, corrección, supresión, renovación o reclamo por infracción sobre sus datos mediante un escrito dirigido a la dirección de correo electrónico [email protected], indicando en el asunto el derecho que desea ejercer. Además, el usuario ha sido informado que puede cancelar o modificar su suscripción a cualquier momento, notificándolo a través del newsletter o enviando un correo a la misma dirección, indicando en el asunto su decisión.;terminos-y-condiciones;Web (HTML);https://deseguridad.net/terminos-y-condiciones/
¿De qué trata 8 TIPS PARA CUIDAR LA SALUD MENTAL - De Seguridad y Prevención laboral y qué información principal ofrece?;"El contenido titulado ""8 TIPS PARA CUIDAR LA SALUD MENTAL - De Seguridad y Prevención laboral"" aborda la importancia de la salud mental en el contexto laboral y social, y destaca la prevalencia de trastornos mentales, subrayando que en Colombia, 4 de cada 10 personas pueden enfrentar situaciones que afectan su salud mental. La información principal ofrecida incluye recomendaciones para la prevención, tales como mantener contacto social y familiar, medir el riesgo psicosocial en las empresas, establecer políticas que promuevan la participación de los colaboradores, escuchar y apoyar a quienes puedan presentar síntomas de problemas mentales, prevenir el bullying, capacitar a los empleados sobre la importancia de la salud mental, fomentar la actividad física y evitar el consumo de sustancias nocivas. Estas recomendaciones buscan contribuir a un ambiente laboral saludable y a la mejora del bienestar general de los individuos.";salud-mental;Web (HTML);https://deseguridad.net/salud-mental/
¿Cómo se relaciona 8 TIPS PARA CUIDAR LA SALUD MENTAL - De Seguridad y Prevención laboral con los servicios de Deseguridad.net?;"El contenido ""8 TIPS PARA CUIDAR LA SALUD MENTAL - De Seguridad y Prevención laboral"" se relaciona directamente con los servicios de Deseguridad.net, ya que enfatiza la importancia de medir el riesgo psicosocial en las empresas como una forma de prevenir problemas de salud mental en el entorno laboral. Esto se alinea con nuestra consultoría en riesgos, donde evaluamos y calibramos situaciones que pueden afectar la salud mental de los colaboradores. Además, las recomendaciones, como fomentar un ambiente laboral positivo a través de políticas de comunicación y participación, son parte de las estrategias que promovemos en nuestros servicios. Para obtener más información específica sobre cómo implementar estos consejos y los servicios relacionados, puedes cotizar en nuestra página web.";salud-mental;Web (HTML);https://deseguridad.net/salud-mental/
¿De qué trata Cómo se Miden los Factores Psicosociales de Riesgo - Deseguridad.net y qué información principal ofrece?;"El artículo ""Cómo se Miden los Factores Psicosociales de Riesgo - Deseguridad.net"" aborda la medición de la batería de riesgo psicosocial, enfocándose en los factores laborales que pueden afectar la salud y el bienestar de los trabajadores. Se destacan las condiciones que pueden inducir tensión y estrés laboral, clasificando los factores de riesgo en intra laborales, extra laborales e individuales. Se menciona que los empleadores deben identificar aspectos relacionados con la gestión organizacional, las condiciones de trabajo, el tiempo libre, el medio de transporte, y datos sociodemográficos de los trabajadores. Además, se explican los métodos de medición a través de cuestionarios de riesgo psicosocial, detallando dos tipos: la Forma A, para trabajadores con cargos de jefatura, y la Forma B, para auxiliares u operarios, señalando la duración promedio de cada cuestionario y el impacto de realizar la aplicación en grupo.";medicion-factores-psicosociales;Web (HTML);https://deseguridad.net/medicion-factores-psicosociales/
¿Cómo se relaciona Cómo se Miden los Factores Psicosociales de Riesgo - Deseguridad.net con los servicios de Deseguridad.net?;"La medición de los factores psicosociales de riesgo descrita en ""Cómo se Miden los Factores Psicosociales de Riesgo - Deseguridad.net"" se encuentra completamente alineada con los servicios ofrecidos por Deseguridad.net, específicamente en el ámbito de consultoría y evaluación de riesgos. Nuestra empresa se especializa en la identificación y análisis de factores psicosociales que pueden afectar la salud y el bienestar de los trabajadores dentro de las organizaciones. A través de cuestionarios específicos, como la Forma A y Forma B, evaluamos las condiciones laborales tanto intra como extra laborales, así como aspectos individuales de los empleados, contribuyendo a un diagnóstico integral de los riesgos psicosociales. Esto no solo permite a las empresas cumplir con las normativas laborales, sino que también promueve un ambiente de trabajo saludable y eficiente. Para más información sobre este servicio, puedes cotizar en la siguiente ruta: https://deseguridad.net/riesgo-psicosocial/.";medicion-factores-psicosociales;Web (HTML);https://deseguridad.net/medicion-factores-psicosociales/
¿De qué trata La Reactivación del sector construcción trae sus retos! - De Seguridad y Prevención laboral y qué información principal ofrece?;"""La Reactivación del sector construcción trae sus retos! - De Seguridad y Prevención laboral"" aborda los desafíos que enfrenta el sector de la construcción en el contexto de la reactivación gradual tras la pandemia de Covid-19. El contenido destaca la importancia de implementar un Plan de Aplicación del Protocolo de Seguridad/Sanitario para la obra (PAPSO), que incluye estrategias y actividades necesarias para minimizar la transmisión del virus y asegurar la protección de los trabajadores. Se detallan elementos clave que debe contener el PAPSO, como la descripción de la labor a ejecutar, los horarios de trabajo, medidas de prevención sanitaria, identificación de zonas de cuidado en salud, y la responsabilidad de un Inspector de Seguridad y Salud en Trabajo por cada cien trabajadores para supervisar el cumplimiento de las medidas. Además, se enfatiza que los empresarios deben tener su plan ordenado antes de reiniciar operaciones.";la-reactivacion-del-sector-construccion-trae-sus-retos;Web (HTML);https://deseguridad.net/la-reactivacion-del-sector-construccion-trae-sus-retos/
¿Cómo se relaciona La Reactivación del sector construcción trae sus retos! - De Seguridad y Prevención laboral con los servicios de Deseguridad.net?;La reactivación del sector construcción, que enfrenta nuevos retos en cuanto a la salud y seguridad de los trabajadores, se alinea perfectamente con los servicios que ofrece Deseguridad.net. Nuestra consultoría se centra en ayudar a las empresas a implementar el Plan de Aplicación del Protocolo Sanitario para la Obra (PAPSO), necesario para minimizar la transmisión del COVID-19. Contamos con expertos que pueden asesorar en la elaboración de este plan, asegurando su cumplimiento con las exigencias normativas y adaptándolo a las especificaciones de cada obra. Además, ofrecemos servicios de mediciones y calibraciones de ambientes laborales, lo que es crucial en el contexto de bioseguridad actual, garantizando condiciones seguras de trabajo. Para obtener más información sobre cómo podemos asistirle en este proceso, le invitamos a cotizar en la siguiente ruta: https://deseguridad.net/riesgo-psicosocial/.;la-reactivacion-del-sector-construccion-trae-sus-retos;Web (HTML);https://deseguridad.net/la-reactivacion-del-sector-construccion-trae-sus-retos/
¿De qué trata La Gestión del Riesgo Psicosocial en tiempos de Cuarentena - De Seguridad y Prevención laboral y qué información principal ofrece?;"""La Gestión del Riesgo Psicosocial en tiempos de Cuarentena - De Seguridad y Prevención laboral"" aborda la manera de afrontar los desafíos que presenta la cuarentena, tanto para el trabajo remoto en aislamiento como para quienes deben cumplir funciones en campo. El contenido se centra en ofrecer apoyo a las personas mediante recomendaciones y mensajes para manejar el estrés y las tensiones asociados a estas circunstancias. Si deseas más información o un análisis detallado de los riesgos psicosociales, puedes cotizar en la siguiente ruta: https://deseguridad.net/riesgo-psicosocial/.";la-gestion-del-riesgo-psicosocial-en-tiempos-de-cuarentena;Web (HTML);https://deseguridad.net/la-gestion-del-riesgo-psicosocial-en-tiempos-de-cuarentena/
¿Cómo se relaciona La Gestión del Riesgo Psicosocial en tiempos de Cuarentena - De Seguridad y Prevención laboral con los servicios de Deseguridad.net?;La Gestión del Riesgo Psicosocial en tiempos de Cuarentena está estrechamente relacionada con los servicios de Deseguridad.net, ya que nuestra consultoría se enfoca en ofrecer apoyo para enfrentar los desafíos que surgen tanto en el trabajo remoto como en el trabajo en campo durante situaciones de aislamiento. Proporcionamos recomendaciones y estrategias para mitigar los efectos del riesgo psicosocial, asegurando un entorno laboral más saludable y seguro. Para más información sobre nuestros servicios y cómo podemos ayudar a su empresa, puede visitar la siguiente ruta: https://deseguridad.net/riesgo-psicosocial/.;la-gestion-del-riesgo-psicosocial-en-tiempos-de-cuarentena;Web (HTML);https://deseguridad.net/la-gestion-del-riesgo-psicosocial-en-tiempos-de-cuarentena/
¿De qué trata 3 recomendaciones de Higiene Psicosocial ante el aislamiento. y qué información principal ofrece?;"El contenido titulado ""3 recomendaciones de Higiene Psicosocial ante el aislamiento"" se centra en la importancia de mantener una adecuada salud mental durante el aislamiento, especialmente en el contexto de la pandemia de Covid-19. Ofrece tres recomendaciones clave para gestionar el riesgo psicosocial que puede surgir en estas circunstancias. Las recomendaciones incluyen la necesidad de evitar la sobre-información, dada la gran cantidad de datos disponibles que pueden causar ansiedad y caos. Se enfatiza que, aunque existen muchas fuentes de información, es esencial aprender a manejarlas para prevenir el estrés asociado al exceso de información. Si deseas más detalles sobre cómo implementar estas recomendaciones y mejorar la gestión del riesgo psicosocial, puedes consultar en la ruta: https://deseguridad.net/riesgo-psicosocial/.";higiene-psicosocial-ante-el-aislamiento;Web (HTML);https://deseguridad.net/higiene-psicosocial-ante-el-aislamiento/
¿Cómo se relaciona 3 recomendaciones de Higiene Psicosocial ante el aislamiento. con los servicios de Deseguridad.net?;"Las ""3 recomendaciones de Higiene Psicosocial ante el aislamiento"" están directamente relacionadas con los servicios de Deseguridad.net, ya que nuestra consultoría se enfoca en la prevención de riesgos psicosociales, promoviendo la salud mental adecuada durante situaciones de crisis como el aislamiento. En este contexto, nuestras recomendaciones buscan ayudar a las personas a manejar el estrés y la sobreinformación, aspectos que son fundamentales para asegurar un entorno laboral y personal saludable. Si deseas obtener más información sobre cómo nuestros servicios pueden ayudarte en la prevención del riesgo psicosocial, te invitamos a cotizar a través de la siguiente ruta: https://deseguridad.net/riesgo-psicosocial/.";higiene-psicosocial-ante-el-aislamiento;Web (HTML);https://deseguridad.net/higiene-psicosocial-ante-el-aislamiento/
¿De qué trata CUIDADOS Y PREVENCIÓN DE ENFERMEDADES POR VIRUS y qué información principal ofrece?;"""CUIDADOS Y PREVENCIÓN DE ENFERMEDADES POR VIRUS"" aborda la epidemiología como una ciencia clave en la medicina preventiva, enfocándose en la aparición de enfermedades en la población laboral y los efectos de las exposiciones en el lugar de trabajo. El contenido destaca la importancia de identificar los factores de riesgo, especialmente aquellos relacionados con peligros biológicos como virus, hongos y bacterias, que pueden causar síntomas como gripa, diarrea o fiebre, perjudicando la productividad en las empresas. Se enfatiza la necesidad de implementar medidas preventivas adecuadas, tales como mantener hábitos saludables en la alimentación, asegurar condiciones higiénicas en la preparación y consumo de alimentos, así como establecer procedimientos de lavado y desinfección de manos. Además, se recomienda consultar al médico regularmente, realizar exámenes de laboratorio y reportar cualquier incidente de exposición a virus para recibir atención oportuna.";cuidados-y-prevencion-de-enfermedades-por-virus;Web (HTML);https://deseguridad.net/cuidados-y-prevencion-de-enfermedades-por-virus/
¿Cómo se relaciona CUIDADOS Y PREVENCIÓN DE ENFERMEDADES POR VIRUS con los servicios de Deseguridad.net?;"Los ""CUIDADOS Y PREVENCIÓN DE ENFERMEDADES POR VIRUS"" se relacionan con los servicios de Deseguridad.net a través de la medicina ocupacional y la epidemiología laboral, que buscan prevenir enfermedades en el entorno laboral identificando y controlando factores de riesgo biológicos, como virus y microorganismos. Deseguridad.net ofrece consultoría y medidas de control que ayudan a las empresas a implementar hábitos saludables, garantizar condiciones adecuadas en la manipulación de alimentos y establecer protocolos de higiene, contribuyendo a la reducción del ausentismo y al aumento de la productividad. Para obtener más detalles sobre nuestros servicios de consultoría en este ámbito, puedes cotizar en la ruta: https://deseguridad.net/riesgo-psicosocial/.";cuidados-y-prevencion-de-enfermedades-por-virus;Web (HTML);https://deseguridad.net/cuidados-y-prevencion-de-enfermedades-por-virus/
¿De qué trata USO DE DATOS INFORMÁTICOS PARA LA SEGURIDAD Y SALUD EN EL TRABAJO y qué información principal ofrece?;"El contenido titulado ""USO DE DATOS INFORMÁTICOS PARA LA SEGURIDAD Y SALUD EN EL TRABAJO"" aborda la importancia de utilizar datos fiables sobre seguridad y salud en el trabajo (SST), destacando la necesidad de que los países mejoren su capacidad de recopilación y uso de dicha información. Se hace hincapié en cómo las nuevas tendencias tecnológicas, junto con herramientas web y almacenamiento en la nube, han permitido la generación de metadatos que, sin un análisis adecuado por parte de profesionales, a menudo solo se utilizan para la elaboración de informes de gestión. Además, el artículo menciona que hay diversas aplicaciones y software que facilitan la gestión de la SST en las empresas, contribuyendo a la prevención de lesiones y a la cultura de autocuidado. Al ingresar información en estos sistemas, se pueden identificar riesgos y desarrollar una cultura preventiva adaptada a las necesidades de cada organización. Finalmente, se resalta que el análisis de los datos y metadatos genera acciones efectivas para mejorar la seguridad y salud de los empleados, ayudando a prevenir enfermedades laborales y mejorando la calidad de vida en el entorno laboral.";uso-de-datos-informaticos-para-la-seguridad-y-salud-en-el-trabajo;Web (HTML);https://deseguridad.net/uso-de-datos-informaticos-para-la-seguridad-y-salud-en-el-trabajo/
