question;answer;category;source;source_url
¿De qué trata ¿SABES DESCANSAR? EL SUEÑO NO ES NEGOCIABLE - De Seguridad y Prevención laboral y qué información principal ofrece?;"El contenido titulado ""¿SABES DESCANSAR? EL SUEÑO NO ES NEGOCIABLE - De Seguridad y Prevención laboral"" aborda la importancia del sueño en la calidad de vida y la salud mental, destacando que descansar es esencial y no debe ser considerado una pérdida de tiempo. Se menciona la experiencia de Jana Fernández, quien a través de su libro ""Aprende a descansar"" y su podcast ""A guide to live well"", comparte su conocimiento sobre la necesidad de un descanso adecuado. Además, se presentan siete pasos para lograr un descanso apropiado: 1. Decisión, 2. Disciplina, 3. Dieta y deporte, 4. Dormir, 5. Desacelera, 6. Desconecta y 7. Disfruta. La importancia de estos hábitos como herramienta para reducir el estrés diario y mejorar la salud mental es un aspecto clave del artículo, que también invita a los lectores a solicitar formaciones ofrecidas por DeSeguridad.net para desarrollar estos hábitos y mejorar su calidad de vida.";sabes-descansar-el-sueno-no-es-negociable;Web (HTML);https://deseguridad.net/sabes-descansar-el-sueno-no-es-negociable/
¿Cómo se relaciona ¿SABES DESCANSAR? EL SUEÑO NO ES NEGOCIABLE - De Seguridad y Prevención laboral con los servicios de Deseguridad.net?;"El artículo ""¿SABES DESCANSAR? EL SUEÑO NO ES NEGOCIABLE - De Seguridad y Prevención laboral"" se relaciona con los servicios de Deseguridad.net al abordar la importancia del descanso y su impacto en la salud mental y la calidad de vida, temas en los que nuestra consultoría puede ofrecer formación y apoyo. Nuestra marca se especializa en proporcionar diferentes temáticas de formación que pueden ayudar a desarrollar hábitos saludables, como los mencionados en el artículo, contribuyendo así a una mejor gestión del estrés y bienestar en el entorno laboral. Para más información sobre nuestros servicios y cómo podemos colaborar en el desarrollo de estas habilidades, te invitamos a explorar nuestra oferta en el sitio web.";sabes-descansar-el-sueno-no-es-negociable;Web (HTML);https://deseguridad.net/sabes-descansar-el-sueno-no-es-negociable/
¿De qué trata Actualización Normativa - Vigencia Marzo 2022 - De Seguridad y Prevención laboral y qué información principal ofrece?;"La ""Actualización Normativa - Vigencia Marzo 2022 - De Seguridad y Prevención laboral"" detalla varias nuevas regulaciones aprobadas en marzo de 2022 que son relevantes para garantizar la actualización de la legislación aplicable y así mejorar la toma de decisiones en las empresas. Se mencionan varios decretos clave, tales como el Decreto 307 que modifica el Arancel de Aduanas, el Decreto 335 que establece procedimientos para certificados de buenas prácticas ante el INVIMA, y el Decreto 338 que introduce lineamientos para la gobernanza de la seguridad digital, entre otros. Estos cambios normativos buscan facilitar la continua adherencia a los estándares de seguridad y salud en el trabajo, además de mejorar la calidad de los procesos empresariales. Para más detalles sobre estas normativas, se recomienda consultar las páginas web de la Presidencia de la República de Colombia, del Ministerio del Trabajo y del Ministerio de Salud.";actualizacion-normativa-vigencia-marzo-2022;Web (HTML);https://deseguridad.net/actualizacion-normativa-vigencia-marzo-2022/
¿Cómo se relaciona Actualización Normativa - Vigencia Marzo 2022 - De Seguridad y Prevención laboral con los servicios de Deseguridad.net?;"La ""Actualización Normativa - Vigencia Marzo 2022 - De Seguridad y Prevención laboral"" está estrechamente relacionada con los servicios de Deseguridad.net, ya que proporciona información sobre nuevas regulaciones que afectan la seguridad y la salud en el trabajo, así como la normativa aplicable en la legislación colombiana. Mantenerse al día con estas actualizaciones es esencial para que nuestros usuarios y clientes puedan tomar decisiones informadas y asegurar el cumplimiento normativo dentro de sus procesos. Nuestro equipo jurídico realiza un seguimiento constante de estas normativas, lo que significa que en Deseguridad.net estamos preparados para ofrecer consultoría y apoyo a las empresas en la implementación de estas regulaciones, además de asegurarnos de que nuestros servicios, como las mediciones y calibraciones relacionadas con la seguridad laboral, se alineen con los requerimientos legales vigentes. Para más información sobre cómo nuestros servicios pueden ayudarle a cumplir con estas normativas, le invitamos a visitar nuestra página web.";actualizacion-normativa-vigencia-marzo-2022;Web (HTML);https://deseguridad.net/actualizacion-normativa-vigencia-marzo-2022/
¿De qué trata RENUNCIÉ A MI TRABAJO Y ME DIERON UNA TORTA - De Seguridad y Prevención laboral y qué información principal ofrece?;"""RENUNCIÉ A MI TRABAJO Y ME DIERON UNA TORTA - De Seguridad y Prevención laboral"" aborda la experiencia de renunciar a un empleo priorizando la salud mental y el autocuidado. El artículo reflexiona sobre las dificultades emocionales que puede conllevar esta decisión, así como la importancia del apoyo social y familiar en momentos de cambio. Se destaca que renunciar puede ser un acto valiente y que marcar un nuevo comienzo es fundamental para priorizar lo que realmente importa en la vida. Además, se analizan las consecuencias de permanecer en un trabajo que no se disfruta, lo que puede afectar el bienestar personal y el desarrollo individual. En este contexto, la salud mental implica recuperar el control de nuestras vidas y mantener conexiones sociales significativas.";renuncie-a-mi-trabajo-y-me-dieron-una-torta;Web (HTML);https://deseguridad.net/renuncie-a-mi-trabajo-y-me-dieron-una-torta/
¿Cómo se relaciona RENUNCIÉ A MI TRABAJO Y ME DIERON UNA TORTA - De Seguridad y Prevención laboral con los servicios de Deseguridad.net?;"El artículo ""RENUNCIÉ A MI TRABAJO Y ME DIERON UNA TORTA - De Seguridad y Prevención laboral"" se relaciona con los servicios de Deseguridad.net en el contexto de la importancia de la salud mental en el ambiente laboral. En Deseguridad.net, brindamos consultoría y servicios que ayudan a las empresas a evaluar y gestionar los riesgos laborales, incluyendo los que afectan la salud mental de los empleados. Esto refuerza la idea de que priorizar el bienestar de los trabajadores no solo es una decisión personal, sino también una responsabilidad organizacional. Ofrecemos herramientas para implementar el Sistema de Gestión de la Seguridad y Salud en el Trabajo (SG-SST), lo que puede ayudar a crear un entorno más saludable y equilibrado que fomente el desarrollo personal y profesional, minimizando así la necesidad de renuncias motivadas por problemas de salud mental. Para más detalles sobre cómo podemos ayudar a tu empresa en este aspecto, puedes cotizar en nuestra página: https://deseguridad.net.";renuncie-a-mi-trabajo-y-me-dieron-una-torta;Web (HTML);https://deseguridad.net/renuncie-a-mi-trabajo-y-me-dieron-una-torta/
¿De qué trata SALUD MENTAL MARZO 2022 - De Seguridad y Prevención laboral y qué información principal ofrece?;"La publicación ""SALUD MENTAL MARZO 2022 - De Seguridad y Prevención laboral"" en Deseguridad.net aborda la importancia de las medidas de autocuidado y salud mental en el contexto de la pandemia por COVID-19. Se menciona en la Resolución 350 de 2022 la necesidad de implementar protocolos de bioseguridad para prevenir el contagio, así como recomendaciones específicas para cuidar la salud mental. Entre estas recomendaciones, se sugiere planificar actividades antes de salir, mantener una actitud positiva en espacios públicos, y promover la interacción social bajo medidas de bioseguridad, especialmente para niños, niñas y adolescentes. También se destaca la importancia de filtrar información, meditar y adaptarse al aislamiento, reconociendo el impacto significativo que la pandemia ha tenido no solo en la salud física sino también en el bienestar mental de las personas.";salud-mental-marzo-2022;Web (HTML);https://deseguridad.net/salud-mental-marzo-2022/
¿Cómo se relaciona SALUD MENTAL MARZO 2022 - De Seguridad y Prevención laboral con los servicios de Deseguridad.net?;La información sobre salud mental presentada en el contenido refleja la importancia de implementar medidas de autocuidado y protocolos de salud que están en línea con los servicios que ofrecemos en Deseguridad.net, particularmente en lo relacionado con la gestión de riesgos psicosociales. Al promover el bienestar mental y emocional en el contexto laboral, nos alineamos con la necesidad de asegurar un ambiente de trabajo saludable. Las recomendaciones mencionadas sobre la atención a emociones, la planificación de actividades, y la promoción de interacciones sociales seguras pueden integrarse en nuestras consultorías y evaluaciones, contribuyendo a un entorno laboral más seguro ypreviniendo riesgos psicosociales. Si deseas conocer más sobre nuestros servicios relacionados con la evaluación de riesgos psicosociales, puedes cotizar en la siguiente ruta: https://deseguridad.net/riesgo-psicosocial/.;salud-mental-marzo-2022;Web (HTML);https://deseguridad.net/salud-mental-marzo-2022/
¿De qué trata La autonomía en la salud laboral  - De Seguridad y Prevención laboral y qué información principal ofrece?;"""La autonomía en la salud laboral - De Seguridad y Prevención laboral"" es un espacio que invita a la reflexión sobre la importancia de valorar el trabajo diario y su impacto en la vida productiva de las personas. Se abordan preguntas clave que cada individuo debe hacerse respecto a su vínculo con el trabajo, como la emoción que les genera, el equilibrio entre la vida laboral y personal, y si su trabajo les ayuda a alcanzar sus objetivos. El texto también menciona una anécdota que destaca el deseo de seguir adelante en la vida, enfatizando la búsqueda de sentido y felicidad en las labores cotidianas. En resumen, el contenido promueve la introspección para mejorar la calidad de vida en el ámbito laboral.";la-autonomia-en-la-salud-laboral-2;Web (HTML);https://deseguridad.net/la-autonomia-en-la-salud-laboral-2/
¿Cómo se relaciona La autonomía en la salud laboral  - De Seguridad y Prevención laboral con los servicios de Deseguridad.net?;La autonomía en la salud laboral, como se aborda en el contenido, se relaciona directamente con los servicios que ofrece Deseguridad.net, ya que estos buscan promover un entorno laboral saludable y productivo. A través de la consultoría y evaluación de riesgos, Deseguridad.net se enfoca en la medición y análisis de factores que pueden afectar la salud laboral, proporcionando herramientas para que las empresas gestionen adecuadamente el bienestar de sus empleados. Esto incluye la identificación de necesidades y la implementación de normativas que fomenten un equilibrio entre la vida personal y laboral, contribuyendo al crecimiento individual y colectivo en el ámbito del trabajo, tal como se reflexiona en el artículo. Si deseas obtener más información sobre cómo estos servicios pueden beneficiar a tu organización, puedes visitar la ruta: https://deseguridad.net/servicios/.;la-autonomia-en-la-salud-laboral-2;Web (HTML);https://deseguridad.net/la-autonomia-en-la-salud-laboral-2/
¿De qué trata SALUD MENTAL FEBRERO 2022 - De Seguridad y Prevención laboral y qué información principal ofrece?;"El contenido titulado ""SALUD MENTAL FEBRERO 2022 - De Seguridad y Prevención laboral"" trata sobre la importancia de cuidar la salud mental y emocional, especialmente en el contexto de la pandemia y el aislamiento preventivo. Ofrece recursos útiles para el cuidado de la salud mental, incluyendo líneas de orientación y recomendaciones para afrontar el periodo de aislamiento. Además, destaca la necesidad de implementar una política de desconexión laboral que garantice un equilibrio entre la vida laboral y social, sugiriendo incluir mecanismos para ejercer este derecho, presentar quejas y un procedimiento para su tramitación.";salud-mental-febrero-2022;Web (HTML);https://deseguridad.net/salud-mental-febrero-2022/
¿Cómo se relaciona SALUD MENTAL FEBRERO 2022 - De Seguridad y Prevención laboral con los servicios de Deseguridad.net?;"La página ""SALUD MENTAL FEBRERO 2022 - De Seguridad y Prevención laboral"" de Deseguridad.net resalta la importancia de cuidar la salud mental y emocional, especialmente en el contexto de la pandemia y el aislamiento. Este enfoque se alinea con los servicios ofrecidos por Deseguridad.net, que incluyen la consultoría sobre riesgos psicosociales y la implementación de políticas de desconexión laboral, contribuyendo así a un equilibrio entre la vida laboral y social. Además, se ofrecen recursos relacionados con el cuidado de la salud mental, como líneas de orientación y recomendaciones, lo que complementa nuestros servicios en la prevención y gestión de riesgos laborales. Para más información sobre cómo podemos ayudar a tu organización en estos aspectos, puedes cotizar en la siguiente ruta: https://deseguridad.net/riesgo-psicosocial/.";salud-mental-febrero-2022;Web (HTML);https://deseguridad.net/salud-mental-febrero-2022/
¿De qué trata La mujer en su lucha - De Seguridad y Prevención laboral y qué información principal ofrece?;"""La mujer en su lucha - De Seguridad y Prevención laboral"" aborda la historia de las mujeres trabajadoras que, desde mediados del siglo XIX y principios del XX, comenzaron a movilizarse para exponer las duras condiciones laborales que enfrentaban, tales como largas jornadas de trabajo, bajos salarios y la exclusión de la vida política. Se menciona un evento trágico en 1857, donde un incendio durante una protesta en Nueva York resultó en la muerte de numerosas trabajadoras, lo que simboliza su lucha por derechos y libertades, representado por el color violeta. La narrativa incluye importantes hitos como la celebración del “Woman’s Day” en 1908 y la propuesta del establecimiento del Día Internacional de la Mujer en 1910. El contenido también destaca los avances conseguidos en pro de la igualdad de género, como la Declaración de Beijing y el Objetivo 5 de la Agenda 2030 para el Desarrollo Sostenible, pero subraya que persisten desigualdades en la participación laboral de mujeres y hombres, evidenciadas en estadísticas de empleo de 2013.";la-mujer-en-su-lucha-por-jaime-andr;Web (HTML);https://deseguridad.net/la-mujer-en-su-lucha-por-jaime-andr/
¿Cómo se relaciona La mujer en su lucha - De Seguridad y Prevención laboral con los servicios de Deseguridad.net?;"La historia de la lucha de las mujeres, como se presenta en ""La mujer en su lucha - De Seguridad y Prevención laboral"", resuena con los servicios de Deseguridad.net al subrayar la importancia de garantizar un entorno laboral seguro y equitativo, lo que es fundamental para la prevención de riesgos laborales. La creciente sensibilidad hacia la igualdad de género y la lucha por los derechos de las trabajadoras se refleja en nuestras consultorías y evaluaciones de riesgos, enfocadas en crear ambientes laborales que promuevan la inclusión y el bienestar de todas las personas, especialmente en contextos de vulnerabilidad. Asimismo, la normativa relacionada con la seguridad y salud en el trabajo busca erradicar desigualdades y fomentar la prevención de situaciones que puedan afectar negativamente a las mujeres en el trabajo. Para conocer más sobre nuestros servicios específicos, te invitamos a visitar nuestra página web.";la-mujer-en-su-lucha-por-jaime-andr;Web (HTML);https://deseguridad.net/la-mujer-en-su-lucha-por-jaime-andr/
¿De qué trata Actualización Normativa / Abril 2022 - De Seguridad y Prevención laboral y qué información principal ofrece?;"La ""Actualización Normativa / Abril 2022 - De Seguridad y Prevención Laboral"" de Deseguridad.net informa sobre las nuevas regulaciones aprobadas en marzo de 2022 que son relevantes para el cumplimiento normativo en las actividades y procesos empresariales. Se destaca la importancia de mantener la legislación actualizada para mejorar la toma de decisiones y garantizar la excelencia empresarial. Entre los decretos mencionados se encuentran el Decreto 487 del 1 de abril de 2022, que regula la valoración de apoyos; el Decreto 539 del 8 de abril de 2022 sobre el Reglamento de Higiene y Seguridad en las labores mineras; y el Decreto 649 del 27 de abril de 2022, que aborda la habilitación del trabajo en casa. Estos decretos son parte del seguimiento que realiza el equipo jurídico de Deseguridad.net en colaboración con aliados como SafetyAreal, y la información adicional se puede consultar en las páginas de la Presidencia de la República de Colombia, el Ministerio del Trabajo y el Ministerio de Salud.";actualizacion-normativa-abril-2022;Web (HTML);https://deseguridad.net/actualizacion-normativa-abril-2022/
¿Cómo se relaciona Actualización Normativa / Abril 2022 - De Seguridad y Prevención laboral con los servicios de Deseguridad.net?;"La ""Actualización Normativa / Abril 2022 - De Seguridad y Prevención laboral"" es relevante para los servicios de Deseguridad.net ya que informamos a nuestros usuarios y clientes sobre las nuevas regulaciones que impactan en la seguridad y salud laboral. Esta normativa actualizada es clave para dar cumplimiento a las exigencias legales y mejorar la toma de decisiones en las empresas, contribuyendo así a garantizar un entorno laboral seguro y efectivo. Para más detalles sobre cómo estas normativas pueden afectar a tu empresa y los servicios que ofrecemos, puedes consultar nuestra página y cotizar en relación a mediciones, calibraciones y gestión de riesgos en la siguiente ruta: https://deseguridad.net/.";actualizacion-normativa-abril-2022;Web (HTML);https://deseguridad.net/actualizacion-normativa-abril-2022/
¿De qué trata ¿SABIAS QUÉ? - El aborto seguro es legal en Colombia - De Seguridad y Prevención laboral y qué información principal ofrece?;"La sección ""¿SABIAS QUÉ? - El aborto seguro es legal en Colombia - De Seguridad y Prevención laboral"" aborda el fallo de la Corte Constitucional de Colombia que despenaliza el aborto antes de la semana 24 de gestación y en determinadas situaciones específicas, como riesgo para la salud de la mujer, violación, incesto o malformación del feto. El contenido enfatiza que el aborto es considerado un derecho fundamental de las mujeres y subraya la necesidad de que el gobierno desarrolle políticas públicas integrales al respecto. Además, apunta a la problemática global de los abortos inseguros que puede generar morbilidad y mortalidad materna, destacando la importancia de garantizar procedimientos seguros. Para más información detallada, puede consultar el comunicado de prensa en el siguiente enlace: https://www.fundacionsimujer.org/web/ive-aborto-legal.";sabias-que-el-aborto-seguro-es-legal-en-colombia;Web (HTML);https://deseguridad.net/sabias-que-el-aborto-seguro-es-legal-en-colombia/
¿Cómo se relaciona ¿SABIAS QUÉ? - El aborto seguro es legal en Colombia - De Seguridad y Prevención laboral con los servicios de Deseguridad.net?;"El contenido titulado ""¿SABIAS QUÉ? - El aborto seguro es legal en Colombia - De Seguridad y Prevención laboral"" se relaciona con los servicios de Deseguridad.net al abordar un tema relevante en el marco de la salud y el bienestar de los trabajadores, especialmente en lo que respecta a los derechos de las mujeres en el ámbito laboral. La sentencia de la Corte Constitucional que se menciona destaca la importancia de implementar políticas públicas integrales en salud que incluyan el acceso a abortos seguros y legales, lo cual puede influir en la gestión de riesgos psicosociales en el entorno laboral. Además, enfatiza la necesidad de que las empresas consideren estas cuestiones dentro de su Sistema de Gestión de Seguridad y Salud en el Trabajo (SG-SST) para proteger a sus empleados. Para más información sobre cómo Deseguridad.net puede ayudar a las empresas a gestionar estos riesgos, puedes visitar la ruta: https://deseguridad.net/riesgo-psicosocial/.";sabias-que-el-aborto-seguro-es-legal-en-colombia;Web (HTML);https://deseguridad.net/sabias-que-el-aborto-seguro-es-legal-en-colombia/
¿De qué trata Boletín 05 - De Seguridad y Prevención laboral y qué información principal ofrece?;El Boletín 05 - De Seguridad y Prevención laboral se centra en la importancia de la implementación del Sistema de Gestión de la Seguridad y Salud en el Trabajo (SG-SST) en las organizaciones, destacando su papel en la prevención de riesgos laborales. Ofrece información principal sobre la normativa vigente relacionada con el SG-SST, su aplicación práctica, y cómo contribuye a la mejora de las condiciones laborales. También se abordan aspectos críticos como la evaluación de riesgos y las medidas preventivas necesarias para garantizar la seguridad de los trabajadores. Para obtener más detalles sobre nuestro servicio de consultoría y cómo podemos ayudar en la implementación del SG-SST, puedes cotizar en nuestra página: https://deseguridad.net/sg-sst/.;boletin-05;Web (HTML);https://deseguridad.net/boletin-05/
¿Cómo se relaciona Boletín 05 - De Seguridad y Prevención laboral con los servicios de Deseguridad.net?;El Boletín 05 - De Seguridad y Prevención Laboral está directamente relacionado con los servicios de Deseguridad.net, ya que proporciona información relevante sobre la implementación y seguimiento del Sistema de Gestión de Seguridad y Salud en el Trabajo (SG-SST), lo que es fundamental para asegurar un ambiente laboral seguro y saludable. Nuestros servicios de consultoría, mediciones, calibraciones y evaluación de riesgos están diseñados para apoyar a las organizaciones en el cumplimiento de la normativa vigente y la mejora continua en sus prácticas de seguridad laboral. Para más detalles sobre cómo podemos asistir en la implementación del SG-SST y otros servicios, te invitamos a cotizar a través de nuestra página: https://deseguridad.net/.;boletin-05;Web (HTML);https://deseguridad.net/boletin-05/
¿De qué trata Actualización Normativa / Leyes nuevas Vigencia 2020-2021 - De Seguridad y Prevención laboral y qué información principal ofrece?;"La ""Actualización Normativa / Leyes nuevas Vigencia 2020-2021 - De Seguridad y Prevención laboral"" ofrece un resumen de las nuevas regulaciones aprobadas durante este periodo que afectan las actividades empresariales en Colombia. Destaca la importancia de estar al tanto de estas normativas para mejorar la toma de decisiones y garantizar la continuidad de los negocios. Se mencionan varias leyes relevantes, incluyendo la Ley 2161 sobre el seguro obligatorio de accidentes de tránsito, la Ley 2162 que crea el Ministerio de Ciencia, Tecnología e Innovación, y otras que promueven la responsabilidad ambiental, la seguridad en la cadena logística, y facilitan la inversión extranjera. Para más detalles sobre las normativas y cómo impactan en procesos y actividades, se sugiere consultar la página web de la Presidencia de la República de Colombia.";actualizacion-normativa-leyes-nuevas-vigencia-2020-2021;Web (HTML);https://deseguridad.net/actualizacion-normativa-leyes-nuevas-vigencia-2020-2021/
¿Cómo se relaciona Actualización Normativa / Leyes nuevas Vigencia 2020-2021 - De Seguridad y Prevención laboral con los servicios de Deseguridad.net?;La actualización normativa y las leyes nuevas vigentes durante 2020-2021 son fundamentales para los servicios que ofrecemos en Deseguridad.net, ya que garantizan que nuestros usuarios y clientes se mantengan al tanto de las regulaciones que afectan su actividad empresarial. Nuestro equipo jurídico, en colaboración con aliados como SafetyA, realiza un seguimiento constante de estas normativas para facilitar una toma de decisiones informada y asegurar el cumplimiento legal en temas de seguridad y prevención laboral. Esto incluye la implementación de medidas derivadas de las nuevas leyes, lo que se traduce en un mejora continua en la gestión de riesgos y prácticas de seguridad en las empresas. Para más información sobre cómo estas normativas pueden afectar su organización y sobre nuestros servicios específicos, le invitamos a consultar nuestra página o a contactarnos directamente.;actualizacion-normativa-leyes-nuevas-vigencia-2020-2021;Web (HTML);https://deseguridad.net/actualizacion-normativa-leyes-nuevas-vigencia-2020-2021/
¿De qué trata Cuidados Frente al COVID-19 - De Seguridad y Prevención laboral y qué información principal ofrece?;"El contenido titulado ""Cuidados Frente al COVID-19 - De Seguridad y Prevención laboral"" aborda la situación de salud pública generada por la pandemia de COVID-19 y su impacto en las actividades cotidianas de personas, empresas y ciudades. En el texto se destacan los principios de promoción de la salud, prevención de riesgos y generación de conocimiento que guían las acciones de Deseguridad.net para garantizar la continuidad de los servicios en las empresas. Se compilan recomendaciones destinadas a mejorar la salud y prevenir enfermedades entre los colaboradores, haciendo énfasis en la importancia de seguir los protocolos establecidos por la Organización Mundial de la Salud (OMS) y el Ministerio de Salud. También se incluye un recurso sobre el correcto lavado de manos y se hace un llamado a la calma, sugiriendo mantenerse informado a través de fuentes oficiales sobre la contención del contagio y las recomendaciones de higiene psicosocial en el contexto del aislamiento.";cuidados-frente-al-covid-19;Web (HTML);https://deseguridad.net/cuidados-frente-al-covid-19/
