question;answer;category;source;source_url
¿Cómo se relaciona USO DE DATOS INFORMÁTICOS PARA LA SEGURIDAD Y SALUD EN EL TRABAJO con los servicios de Deseguridad.net?;El uso de datos informáticos para la seguridad y salud en el trabajo está íntimamente relacionado con los servicios de Deseguridad.net, ya que nuestra consultoría se enfoca en la implementación de herramientas tecnológicas y software que optimizan la gestión de la seguridad y salud laboral. Estas herramientas permiten recolectar y analizar información crítica para identificar y mitigar riesgos, al mismo tiempo que promueven una cultura de autocuidado y protección entre los trabajadores. A través de nuestras soluciones, ayudamos a las empresas a aprovechar los metadatos generados por estos sistemas, facilitando la toma de decisiones informadas para prevenir lesiones y enfermedades laborales, así como a gestionar efectivamente las peticiones y quejas de los empleados. Para más información sobre cómo podemos asistir a tu empresa en este ámbito, te invito a consultar nuestros servicios en https://deseguridad.net/servicios/;uso-de-datos-informaticos-para-la-seguridad-y-salud-en-el-trabajo;Web (HTML);https://deseguridad.net/uso-de-datos-informaticos-para-la-seguridad-y-salud-en-el-trabajo/
¿De qué trata PROYECTO MODIFICACIÓN ESTÁNDARES MÍNIMOS - De Seguridad y Prevención laboral y qué información principal ofrece?;"El ""PROYECTO MODIFICACIÓN ESTÁNDARES MÍNIMOS - De Seguridad y Prevención laboral"" se refiere a una iniciativa del Ministerio del Trabajo que busca modificar los estándares mínimos en seguridad y salud en el trabajo, establecidos por la Resolución 1111 del 2017. Este proyecto se centra especialmente en las empresas de menos de 50 trabajadores, proponiendo recomendaciones y ajustes en la normativa para facilitar su cumplimiento, con el fin de mejorar la calidad de vida laboral y la productividad. Aunque este proyecto introduce cambios para hacerlo más accesible, todavía no está vigente, ya que requiere la expedición de una norma definitiva. Las modificaciones contemplan simplificaciones en el cumplimiento normativo para empresas de sectores específicos, especialmente aquellas con recursos limitados, al mismo tiempo que permite que gremios y administradoras de riesgos laborales elaboren guías para la adecuada implementación de las prácticas de seguridad y salud en estas pequeñas empresas.";proyecto-modificacion-estandares-minimos;Web (HTML);https://deseguridad.net/proyecto-modificacion-estandares-minimos/
¿Cómo se relaciona PROYECTO MODIFICACIÓN ESTÁNDARES MÍNIMOS - De Seguridad y Prevención laboral con los servicios de Deseguridad.net?;"El ""PROYECTO MODIFICACIÓN ESTÁNDARES MÍNIMOS - De Seguridad y Prevención laboral"" se relaciona directamente con los servicios de Deseguridad.net al abordar aspectos cruciales para la implementación de estándares en seguridad y salud en el trabajo, especialmente para pequeñas y medianas empresas. En este contexto, Deseguridad.net puede ofrecer consultoría para guiar a las empresas en el cumplimiento de estas nuevas normativas y en la implementación de sistemas de seguridad más adecuados a su tamaño y sector. Además, nuestros servicios pueden incluir la medición y calibración de condiciones laborales, evaluación de riesgos y el desarrollo de planes de mejora, lo que resulta esencial para ayudar a las empresas a mantener la calidad de vida de sus trabajadores y mejorar su productividad. Para más detalles sobre nuestros servicios y cómo podemos ayudarles a cumplir con estas normativas, pueden consultar más información en nuestra página web.";proyecto-modificacion-estandares-minimos;Web (HTML);https://deseguridad.net/proyecto-modificacion-estandares-minimos/
¿De qué trata 6 CARACTERÍSTICAS PARA IDENTIFICACION DE LOS RIESGOS PSICOSOCIALES - DESEGURIDAD.NET y qué información principal ofrece?;"El artículo ""6 CARACTERÍSTICAS PARA IDENTIFICACION DE LOS RIESGOS PSICOSOCIALES - DESEGURIDAD.NET"" aborda la identificación de los riesgos psicosociales en las organizaciones y su impacto en la salud y productividad de los trabajadores. Destaca que estos riesgos son originados por las condiciones laborales y enfatiza la importancia de un ambiente favorable para la salud mental, física y social de los empleados. Proporciona seis características esenciales para la identificación de estos riesgos: 1) Gestión Organizacional, que establece la necesidad de reconocer la importancia del recurso humano en la organización; 2) Características de la organización del trabajo, que incluyen aspectos como la comunicación y la carga laboral; 3) Características del grupo social de trabajo, que enfatizan un ambiente de relaciones laborales positivas; 4) Condiciones de la tarea, que abordan elementos como la carga mental y las demandas emocionales; 5) Interface persona-tarea, que se refiere a la adecuación entre habilidades del trabajador y las demandas del trabajo; y 6) Jornada de trabajo, que examina horarios y pausas. El artículo concluye enfatizando la necesidad de realizar diagnósticos a través de las Baterías de Riesgo Psicosocial para mitigar estos riesgos y promover el bienestar laboral.";6-caracteristicas-de-los-riesgos-psicosociales;Web (HTML);https://deseguridad.net/6-caracteristicas-de-los-riesgos-psicosociales/
¿Cómo se relaciona 6 CARACTERÍSTICAS PARA IDENTIFICACION DE LOS RIESGOS PSICOSOCIALES - DESEGURIDAD.NET con los servicios de Deseguridad.net?;"Las ""6 características para identificación de los riesgos psicosociales"" abordadas en Deseguridad.net son fundamentales para el diagnóstico y la gestión del bienestar de los trabajadores en una organización. Estas características permiten identificar los factores que afectan la salud y productividad de los empleados, lo cual es crucial para el diseño de estrategias de mejora. En este contexto, los servicios de Deseguridad.net incluyen la aplicación de Baterías de Riesgo Psicosocial, herramientas diseñadas específicamente para evaluar y medir estos aspectos en la población laboral. Al realizar estas evaluaciones, se busca detectar condiciones riesgosas actuales y desarrollar mecanismos que mitiguen los riesgos psicosociales, garantizando así un entorno laboral más saludable y productivo. Para más información sobre la implementación de estos servicios, puedes cotizar en la siguiente ruta: https://deseguridad.net/riesgo-psicosocial/.";6-caracteristicas-de-los-riesgos-psicosociales;Web (HTML);https://deseguridad.net/6-caracteristicas-de-los-riesgos-psicosociales/
¿De qué trata ATENCIÓN PRIORITARIA EN SALUD - De Seguridad y Prevención laboral y qué información principal ofrece?;"El contenido titulado ""ATENCIÓN PRIORITARIA EN SALUD - De Seguridad y Prevención laboral"" aborda la importancia del derecho a la salud en Colombia, destacando la necesidad de garantizar el acceso a servicios de salud para grupos en especial protección, como mujeres gestantes, niños, personas con discapacidad y adultos mayores. Se explica que la atención prioritaria en salud consiste en un conjunto de procedimientos que utilizan recursos físicos, humanos y tecnológicos para atender de manera urgente a estas personas sin necesidad de recurrir a salas de urgencias, que suelen estar congestionadas. Se menciona la disponibilidad de los CAPS (Centros de Atención Prioritaria en Salud) en Bogotá, que ayudan a descongestionar los servicios de urgencias. Además, se proporciona recomendaciones para la prevención de condiciones que afecten la salud, tales como visitar al médico al menos dos veces al año, evitar alimentos perjudiciales, realizar actividad física y garantizar el cumplimiento de las recomendaciones médicas en el ámbito laboral.";atencion-prioritaria-en-salud;Web (HTML);https://deseguridad.net/atencion-prioritaria-en-salud/
¿Cómo se relaciona ATENCIÓN PRIORITARIA EN SALUD - De Seguridad y Prevención laboral con los servicios de Deseguridad.net?;"La ""ATENCIÓN PRIORITARIA EN SALUD"" se relaciona con los servicios de Deseguridad.net al abordar la importancia del derecho a la salud y la prevención de condiciones que puedan afectar el bienestar físico y mental de los empleados. En este contexto, Deseguridad.net puede ofrecer consultorías y asistencia en la implementación de medidas que garanticen el cumplimiento de normativas relacionadas con la salud ocupacional, así como la realización de evaluaciones y capacitaciones que ayuden a prevenir riesgos laborales y mejorar el estado de salud de los trabajadores. Esto incluye la promoción de hábitos saludables y la atención a grupos vulnerables, lo cual es esencial para crear un ambiente de trabajo seguro y saludable. Para más detalles sobre nuestros servicios, puede visitar nuestras secciones específicas en la página web.";atencion-prioritaria-en-salud;Web (HTML);https://deseguridad.net/atencion-prioritaria-en-salud/
¿De qué trata ¿Por qué volvimos con un boletín de SG-SST? - De Seguridad y Prevención laboral y qué información principal ofrece?;"El artículo ""¿Por qué volvimos con un boletín de SG-SST? - De Seguridad y Prevención laboral"" aborda el relanzamiento del boletín mensual de Deseguridad.net, con el propósito de generar conocimiento y apoyar la gestión y el reconocimiento competitivo de las empresas en el ámbito de la seguridad y salud en el trabajo (SG-SST). Se explica que este relanzamiento coincide con el periodo en el que se debe reportar la autoevaluación de estándares mínimos de seguridad y salud, lo que permite coordinar planes de trabajo más estructurados para mejorar continuamente los SG-SST. Además, se mencionan los avances de la empresa en los últimos años, como el reconocimiento como Sociedad de Beneficio e Interés Colectivo (BIC) y la autorización para dictar cursos virtuales gratuitos en SG-SST, así como la creación del Club del Emprendimiento. El boletín incluirá información sobre actualizaciones normativas, cursos virtuales gratuitos y novedades en tendencias y procesos.";por-que-volvimos-con-un-boletin-de-sg-sst;Web (HTML);https://deseguridad.net/por-que-volvimos-con-un-boletin-de-sg-sst/
¿Cómo se relaciona ¿Por qué volvimos con un boletín de SG-SST? - De Seguridad y Prevención laboral con los servicios de Deseguridad.net?;El relanzamiento del boletín de SG-SST por parte de Deseguridad.net está directamente relacionado con nuestro compromiso de generar conocimiento y apoyar la gestión de las empresas en materia de seguridad y salud en el trabajo. Este boletín tiene como objetivo informar sobre las necesidades normativas en SG-SST y coordinar planes de trabajo que mejoren continuamente los sistemas de gestión de seguridad y salud en las empresas. Además, presentaremos avances significativos de la empresa, como la autorización para ofrecer un curso virtual gratuito de 50 horas en SG-SST y la creación del Club del Emprendimiento, entre otros. A través del boletín, buscamos mantener a nuestros clientes informados sobre regulaciones, cursos y novedades del sector, contribuyendo así a su reconocimiento competitivo en el mercado nacional. Para más información sobre nuestros servicios especializados en riesgos laborales, puedes visitar nuestra página web.;por-que-volvimos-con-un-boletin-de-sg-sst;Web (HTML);https://deseguridad.net/por-que-volvimos-con-un-boletin-de-sg-sst/
¿De qué trata Medidas laborales en la pandemia - De Seguridad y Prevención laboral y qué información principal ofrece?;"El artículo ""Medidas laborales en la pandemia - De Seguridad y Prevención laboral"" aborda las diversas acciones y cambios en el ámbito laboral que surgieron a raíz de la pandemia por COVID-19, enfatizando cómo estas medidas reflejan la capacidad de resiliencia y adaptación de las empresas y trabajadores. Se destaca la relevancia del teletrabajo, que si bien se mencionaba en Colombia desde 2008, adquirió una gran importancia durante la pandemia para asegurar la continuidad del empleo. Además, el texto menciona que se presentarán actualizaciones normativas vigentes durante enero y febrero de 2022, recomendaciones sobre salud mental originadas por la pandemia, y se reconoce el Día Internacional de la Mujer, proporcionando un contexto sobre la lucha y situación actual de las mujeres en diversas áreas. También se sugiere que los lectores encuentren información sobre tendencias actuales y eventos formativos que pueden contribuir a la innovación en las empresas.";medidas-laborales-en-la-pandemia;Web (HTML);https://deseguridad.net/medidas-laborales-en-la-pandemia/
¿Cómo se relaciona Medidas laborales en la pandemia - De Seguridad y Prevención laboral con los servicios de Deseguridad.net?;"Las ""Medidas laborales en la pandemia - De Seguridad y Prevención laboral"" están directamente relacionadas con los servicios de Deseguridad.net, ya que abordan las iniciativas que han surgido para garantizar la seguridad y el bienestar de los trabajadores en un contexto de crisis sanitaria. En este sentido, nuestra consultoría ofrece orientación sobre el cumplimiento de normativas laborales actualizadas, así como la implementación de estrategias de teletrabajo y la atención a la salud mental de los empleados, aspectos que han cobrado relevancia durante la pandemia. Además, proporcionamos servicios de mediciones y calibraciones en materia de riesgos, garantizando que las empresas adopten prácticas seguras y efectivas en sus entornos laborales. Para más información sobre cómo podemos ayudar a tu empresa en este contexto, te invitamos a visitar nuestra página web.";medidas-laborales-en-la-pandemia;Web (HTML);https://deseguridad.net/medidas-laborales-en-la-pandemia/
¿De qué trata La autonomía en la salud laboral - De Seguridad y Prevención laboral y qué información principal ofrece?;"""La autonomía en la salud laboral - De Seguridad y Prevención laboral"" es un artículo que reflexiona sobre la importancia de valorar nuestras actividades diarias en el contexto laboral y su impacto en la salud y el bienestar general. Se invita a los lectores a examinar su relación con el trabajo a través de preguntas que estimulan la autoevaluación respecto a sus emociones hacia su ocupación, la adecuación de su trabajo a sus objetivos personales y el equilibrio entre su vida laboral y personal. Además, el artículo menciona actualizaciones normativas en Colombia, brinda información sobre salud mental relacionada con los efectos de la pandemia por COVID-19, y ofrece recursos para mejorar la salud mental y el descanso. También se incluye información sobre novedades en procesos industriales y oportunidades de formación. Para más detalles y cotizaciones sobre temas específicos, se puede visitar la ruta correspondiente en nuestra web.";la-autonomia-en-la-salud-laboral;Web (HTML);https://deseguridad.net/la-autonomia-en-la-salud-laboral/
¿Cómo se relaciona La autonomía en la salud laboral - De Seguridad y Prevención laboral con los servicios de Deseguridad.net?;La autonomía en la salud laboral se relaciona con los servicios de Deseguridad.net al promover un enfoque integral hacia la valoración del bienestar en el trabajo, lo cual es fundamental en el marco del Sistema de Gestión de Seguridad y Salud en el Trabajo (SG-SST). En este contexto, ofrecemos servicios de consultoría, mediciones y calibraciones relacionadas con el riesgo psicosocial, así como actualizaciones normativas que ayudan a las empresas a adaptarse a las regulaciones vigentes. Asimismo, proporcionamos información y recursos sobre salud mental, que se han vuelto cruciales debido a los cambios provocados por la pandemia de COVID-19. Para conocer más sobre nuestros servicios específicos, puedes acceder a nuestra página web y cotizar directamente en las áreas de interés que necesites.;la-autonomia-en-la-salud-laboral;Web (HTML);https://deseguridad.net/la-autonomia-en-la-salud-laboral/
¿De qué trata Liderazgo y su impacto en la SST - De Seguridad y Prevención laboral y qué información principal ofrece?;"El contenido titulado ""Liderazgo y su impacto en la SST - De Seguridad y Prevención laboral"" aborda la importancia del liderazgo en el contexto de la seguridad y salud en el trabajo (SST). Se enfatiza que un líder es alguien que guía y moviliza a las personas para enfrentar desafíos difíciles, lo que se denomina liderazgo adaptativo. Este concepto se relaciona con la capacidad de adaptación y supervivencia, donde un buen líder no solo preserva y reordena recursos relevantes, sino que también crea nuevas estructuras que facilitan el desarrollo en entornos desafiantes. Además, se presentan las características de un líder efectivo bajo el acrónimo SMILE, que destaca la importancia de soñar, medir, innovar, liderar y entregar resultados. También se menciona el liderazgo transformador como un método que promueve el cambio y la creatividad, enfatizando el compromiso necesario para alcanzar los objetivos de negocio.";liderazgo-y-su-impacto-en-la-sst;Web (HTML);https://deseguridad.net/liderazgo-y-su-impacto-en-la-sst/
¿Cómo se relaciona Liderazgo y su impacto en la SST - De Seguridad y Prevención laboral con los servicios de Deseguridad.net?;El liderazgo es fundamental en el contexto de la Seguridad y Salud en el Trabajo (SST), ya que un líder efectivo puede movilizar a las personas para enfrentar desafíos en el entorno laboral, promover la adaptación y la mejora continua en la gestión de riesgos. En Deseguridad.net, comprendemos que un liderazgo transformador puede influir positivamente en la cultura de seguridad de una organización, fomentando el compromiso de los empleados hacia la prevención y el cumplimiento de la normativa. Nuestros servicios, como la consultoría en SST, mediciones y calibraciones de riesgos, son diseñados para apoyar a las empresas en la implementación de prácticas de liderazgo que aseguren un ambiente laboral más seguro y saludable. Para obtener más información sobre cómo podemos ayudar a su organización, puede cotizar en nuestra página web: https://deseguridad.net/.;liderazgo-y-su-impacto-en-la-sst;Web (HTML);https://deseguridad.net/liderazgo-y-su-impacto-en-la-sst/
¿De qué trata ¿Porqué implementar un sistema de gestión de seguridad y salud en el trabajo? - De Seguridad y Prevención laboral y qué información principal ofrece?;"La página ""¿Porqué implementar un sistema de gestión de seguridad y salud en el trabajo? - De Seguridad y Prevención laboral"" de Deseguridad.net aborda la importancia de implementar un sistema de gestión en seguridad y salud laboral, destacando beneficios como la disminución de accidentes de trabajo, el aumento del sentido de pertenencia hacia la organización, y la promoción de un ambiente de vida saludable. También menciona que la instauración de este sistema capacita al personal en temas de seguridad y salud, reduce el ausentismo laboral y, por ende, mejora la productividad de la empresa. Además, se describen las fases de implementación de los estándares mínimos en seguridad y salud laboral, de acuerdo con la Resolución 0312 del 2019, que incluyen la evaluación inicial, el plan de mejoramiento, la ejecución, el seguimiento y la inspección. Para más detalles sobre la implementación y los servicios específicos, puedes visitar nuestra ruta de cotización en https://deseguridad.net/riesgo-psicosocial/.";porque-implementar-un-sistema-de-gestion-de-seguridad-y-salud-en-el-trabajo;Web (HTML);https://deseguridad.net/porque-implementar-un-sistema-de-gestion-de-seguridad-y-salud-en-el-trabajo/
¿Cómo se relaciona ¿Porqué implementar un sistema de gestión de seguridad y salud en el trabajo? - De Seguridad y Prevención laboral con los servicios de Deseguridad.net?;Implementar un sistema de gestión de seguridad y salud en el trabajo se relaciona estrechamente con los servicios de Deseguridad.net, ya que ofrecemos consultoría y apoyo en la evaluación inicial y la implementación de los estándares mínimos en seguridad y salud laboral, según lo establecido en la Resolución 0312 del 2019. Nuestros servicios ayudan a disminuir los accidentes de trabajo, fomentar un ambiente saludable, capacitar personal en temas de seguridad, y reducir el ausentismo laboral, lo que a su vez mejora la productividad de su empresa. Además, guiamos a las organizaciones a través de las fases de implementación, que incluyen la evaluación inicial, planificación de mejoras, ejecución y seguimiento. Para obtener más información sobre cómo podemos ayudarle en este proceso, le invitamos a visitar nuestra página para cotizar: https://deseguridad.net/.;porque-implementar-un-sistema-de-gestion-de-seguridad-y-salud-en-el-trabajo;Web (HTML);https://deseguridad.net/porque-implementar-un-sistema-de-gestion-de-seguridad-y-salud-en-el-trabajo/
¿De qué trata Actualización normativa vigencia enero y febrero 2022 - De Seguridad y Prevención laboral y qué información principal ofrece?;"La ""Actualización normativa vigencia enero y febrero 2022 - De Seguridad y Prevención laboral"" ofrece un resumen de nuevas regulaciones aprobadas que son relevantes para las actividades empresariales y la seguridad laboral en Colombia. Destaca la importancia de mantenerse al tanto de la legislación vigente para mejorar la toma de decisiones y asegurar la excelencia empresarial. Entre las principales normas mencionadas se encuentran la Ley 2182, que modifica aspectos de la educación superior; la Ley 2191, que regula la desconexión laboral estableciendo políticas para su implementación en las empresas; y la Ley 2194, que busca eliminar barreras en programas de rehabilitación para personas con cáncer, además de otras leyes que abordan temas como la seguridad ciudadana y la reactivación económica del transporte público. Para información más detallada sobre estas y otras normativas, se recomienda consultar las páginas oficiales de la Presidencia de la República de Colombia, del Ministerio del Trabajo y del Ministerio de Salud.";actualizacion-normativa-vigencia-enero-y-febrero-2022;Web (HTML);https://deseguridad.net/actualizacion-normativa-vigencia-enero-y-febrero-2022/
¿Cómo se relaciona Actualización normativa vigencia enero y febrero 2022 - De Seguridad y Prevención laboral con los servicios de Deseguridad.net?;La actualización normativa de enero y febrero de 2022 es relevante para los servicios de Deseguridad.net porque proporciona un contexto legal y regulatorio que nuestros clientes deben considerar en sus actividades de seguridad y prevención laboral. El conocimiento de estas normativas permite a las empresas cumplir con sus obligaciones legales y mejorar su gestión de riesgos, facilitando el camino hacia la excelencia empresarial. En Deseguridad.net, trabajamos para mantener a nuestros usuarios informados sobre las normativas aplicables y brindarles apoyo en la implementación de estos requisitos a través de nuestros servicios de consultoría, mediciones y calibraciones, asegurando así que sus operaciones se alineen con las regulaciones vigentes. Para obtener más información específica sobre cómo estas leyes pueden impactar en sus procesos, les invitamos a visitar nuestra página web.;actualizacion-normativa-vigencia-enero-y-febrero-2022;Web (HTML);https://deseguridad.net/actualizacion-normativa-vigencia-enero-y-febrero-2022/
¿De qué trata Medidas laborales en la pandemia - De Seguridad y Prevención laboral y qué información principal ofrece?;"El artículo ""Medidas laborales en la pandemia - De Seguridad y Prevención laboral"" aborda las iniciativas y cambios significativos en el ámbito laboral que surgieron a raíz de la pandemia de covid-19. Destaca cómo, a pesar de que el teletrabajo se había discutido en Colombia desde 2008, solo adquirió relevancia con la llegada de la pandemia, llevándolas empresas a implementar esta modalidad para garantizar el empleo de sus trabajadores. Además, menciona que durante este periodo se adoptaron medidas como el retiro de cesantías y la asignación de vacaciones. Se introduce el concepto de ""trabajo en casa"", establecido de manera excepcional o temporal, con una notable adopción del 91% por las empresas colombianas, según el Ministerio TIC. El texto también enfatiza los nuevos retos en materia de riesgos laborales, especialmente en áreas biomecánicas, psicosociales y de seguridad, debido a las condiciones de trabajo en los hogares, que pueden provocar desórdenes musculoesqueléticos y problemas de salud mental, como depresión y ansiedad.";medidas-laborales-en-la-pandemia-2;Web (HTML);https://deseguridad.net/medidas-laborales-en-la-pandemia-2/
¿Cómo se relaciona Medidas laborales en la pandemia - De Seguridad y Prevención laboral con los servicios de Deseguridad.net?;Las medidas laborales adoptadas durante la pandemia, como el teletrabajo y el trabajo en casa, están directamente relacionadas con los servicios de Deseguridad.net, ya que estas nuevas modalidades han generado desafíos en la identificación y gestión de riesgos laborales. Específicamente, se requieren evaluaciones y medidas en áreas como riesgos biomecánicos y psicosociales, los cuales son fundamentales para garantizar la seguridad y bienestar de los trabajadores en estos entornos. Deseguridad.net ofrece consultorías, mediciones y análisis de riesgos para abordar estos desafíos, asegurando que las empresas puedan adaptarse adecuadamente a las nuevas normativas y condiciones de trabajo impuestas por la pandemia. Para más detalles sobre nuestros servicios en este ámbito, puedes visitar nuestra página en https://deseguridad.net/riesgo-psicosocial/.;medidas-laborales-en-la-pandemia-2;Web (HTML);https://deseguridad.net/medidas-laborales-en-la-pandemia-2/
